Maple,Oak,Birch,Willow,Cedar,Elm,Chestnut,Hemlock,Pine,Ash,Magnolia,Dogwood
Detroit Catholic Central A (DCC A),Hunter A,Stevenson A,Dorman,Ithaca A,Naperville North (Naperville),Westview,Barrington,LASA,Chattahoochee A (Chatt. A),St. John's,Washington A
Mather,Sidney,High Tech A,Homestead,Canyon Crest Academy A (CCA A),Lehigh Valley,Southside  A,Dublin Scioto,IMSA,La Jolla,Richard Montgomery (Rich. Mont.),Thomas Jefferson (VA) A (TJ-VA A)
Rockford Auburn (Auburn),Detroit Country Day (DCD),Detroit Catholic Central B (DCC B),Dunbar A,Beavercreek,Ladue A,Northview,Maggie Walker (MLWGS),Mountain Lakes (Mtn. Lakes),Lempa,Rancho Bernardo (Rancho),Miami Valley
Johns Creek,University Lab (Univ. Lab),Davis,Trinity,Phillips Academy (Phillips),Collins Hill,William Henry Harrison (WHH),Strake Jesuit,Glasgow,Fisher Catholic (Fish. Cath.),Woodford County (Woodford),NCSSM
Danville,Chattahoochee B (Chatt. B),Marist School (Marist),Waubonsie Valley (Waubonsie),Loyola,Hunter B,Lisgar A,Simon Kenton,St. Thomas,Thomas Jefferson (VA) B (TJ-VA B),Middlesex County Academy (Middlesex),Homewood-Flossmoor (Home. Floss.)
Ithaca B,Ed W. Clark,Carbondale,Rock Bridge A,Detroit Catholic Central C (DCC C),Metea Valley,Northmont,High Tech B,Cathedral Classic (Cath. Class),St. Joseph,Washington B,Singapore American (Sing. Am.)
Wayzata,Orchard Farm,Southside B,Utica Academy (Utica),Thomas Jefferson (VA) C (TJ-VA C),Norman,Keith Country Day (KCD),Ladue B,Thomas Jefferson (MO) (TJ-MO),Mount Pleasant Sacred Heart (MPSH),Carl Sandburg (Sandburg),Canyon Crest Academy B (CCA B)
Rock Bridge B,Cupertino,Dunbar B,Stevenson B,Lisgar B,Olentangy Liberty (Olentangy),Northwest,Emma Willard (E. Willard),Amador Valley (Amador),Hannibal,Pi-oneers,Wilmington Charter (Charter)
