Maple,Oak,Birch,Willow,Cedar,Elm,Chestnut,Hemlock,Pine,Ash,Magnolia,Dogwood
Detroit Catholic Central A (DCC A),Hunter A,Stevenson A,Dorman,Ithaca A,Naperville North (Naperville),Westview,Barrington,LASA,Chattahoochee A (Chatt. A),St. John's,Washington A
Wayzata,Sidney,High Tech A,Homestead,Canyon Crest Academy A (CCA A),Lehigh Valley,Southside A,Dublin Scioto,IMSA,La Jolla,Richard Montgomery (Rich. Mont.),Thomas Jefferson (VA) A (TJ-VA A)
Mather,Detroit Country Day (DCD),Detroit Catholic Central B (DCC B),Mountain Lakes (Mtn Lakes),Lempa,Beavercreek,Ladue A,Northview,Maggie Walker (MLWGS),Rockford Auburn (Auburn),Rancho Bernardo (Rancho),Dunbar A
University Lab (Univ. Lab),Davis,Phillips Academy (Phillips),NCSSM,William Henry Harrison (WHH),Collins Hill,Glasgow,Strake Jesuit,Trinity,Fisher Catholic (Fish. Cath.),Woodford County (Woodford),Miami Valley
Johns Creek,Chattahoochee B (Chatt. B),Marist School (Marist),St. Thomas,Thomas Jefferson (VA) B (TJ-VA B),Hunter B,Loyola,Lisgar A,Simon Kenton,Danville,Middlesex County Academy (Middlesex),Waubonsie Valley (Waubonsie)
Ed W. Clark,Carbondale,St. Joseph,Rock Bridge A,Metea Valley,High Tech B,Northmont,Cathedral Classic (Cath. Classic),Singapore American (Sing. Am.),Detroit Catholic Central C (DCC C),Washington B,Homewood-Flossmoor (Home. Floss.)
Ithaca B,Orchard Farm,Southside B,Utica Academy (Utica),Mount Pleasant Sacred Heart (MPSH),Ladue B,Norman,Keith Country Day (KCD),Thomas Jefferson (MO) (TJ-MO),Thomas Jefferson (VA) C (TJ-VA C),Carl Sandburg (Sandburg),Canyon Crest  Academy B (CCA B)
Cupertino,Dunbar B,Olentangy Liberty (Olentangy),Stevenson B,Northwest,Lisgar B,Emma Willard (E. Willard),Rock Bridge B,Amador Valley (Amador),Hannibal,Pi-oneers,Wilmington Charter (Charter)
